{
  "id": "kommandos",
  "name": "Kommandos",
  "factionKeyword": "KOMMANDO",
  "archetypes": ["infiltration", "seek-and-destroy"],
  "selection": {
    "slots": [
      { "id": "leader", "label": "Leader", "count": 1, "from": ["kom.boss-nob"] },
      {
        "id": "main",
        "label": "Selections",
        "count": 9,
        "from": [
          "kom.bomb-squig",
          "kom.boy",
          "kom.breacha-boy",
          "kom.burna-boy",
          "kom.comms-boy",
          "kom.dakka-boy",
          "kom.grot",
          "kom.rokkit-boy",
          "kom.slasha-boy",
          "kom.snipa-boy"
        ],
        "repeatable": ["kom.boy"],
        "halfSelections": ["kom.bomb-squig", "kom.grot"]
      }
    ]
  },
  "factionRules": ["kom.a.throat-slittas"],
  "ploys": [
    "kom.p.dakka-dakka-dakka",
    "kom.p.waaagh",
    "kom.p.skulk-about",
    "kom.p.ssssshhhh",
    "kom.p.just-a-scratch",
    "kom.p.krump-em",
    "kom.p.kunnin-but-brutal",
    "kom.p.shake-it-off"
  ],
  "equipment": ["kom.e.choppas", "kom.e.dynamite", "kom.e.harpoon", "kom.e.collapsible-stocks"],
  "paint": { "major": { "h": 0.28, "s": 0.5, "l": 0.32 }, "minor": { "h": 0.07, "s": 0.6, "l": 0.35 } },
  "text": "A sneaky ork raiding mob: a Boss Nob and nine selections, built around creeping up under Conceal orders and charging out of the shadows.",
  "source": "team-kommandos.pdf; docs/spec/13-teams.md 2.1"
}
